{
  "schemaVersion": 1,
  "id": "kukhnya-s06e20-scene-02",
  "lines": [
    {
      "seg": 1,
      "trans": "Wait, did he pay the money after all?",
      "words": [
        {
          "t": "Он",
          "lemma": "он",
          "pos": "pron",
          "stress": null,
          "gloss": "he",
          "gram": "3rd person singular nominative"
        },
        {
          "t": "что,",
          "lemma": "что",
          "pos": "pron",
          "stress": null,
          "gloss": "what, that",
          "gram": "pronoun / conjunction"
        },
        {
          "t": "всё-таки",
          "lemma": "всё-таки",
          "pos": "part",
          "stress": "всё-таки",
          "gloss": "after all, still",
          "gram": "particle"
        },
        {
          "t": "заплатил",
          "lemma": "заплатить",
          "pos": "verb",
          "stress": "запла́тил",
          "gloss": "to pay",
          "gram": "past tense, masculine singular"
        },
        {
          "t": "деньги?",
          "lemma": "деньги",
          "pos": "noun",
          "stress": "де́ньги",
          "gloss": "money",
          "gram": "nominative plural"
        }
      ]
    },
    {
      "seg": 2,
      "trans": "Yes, he paid, of course.",
      "words": [
        {
          "t": "Да,",
          "lemma": "да",
          "pos": "part",
          "stress": null,
          "gloss": "yes",
          "gram": "particle"
        },
        {
          "t": "он",
          "lemma": "он",
          "pos": "pron",
          "stress": null,
          "gloss": "he",
          "gram": "3rd person singular nominative"
        },
        {
          "t": "заплатил,",
          "lemma": "заплатить",
          "pos": "verb",
          "stress": "запла́тил",
          "gloss": "to pay",
          "gram": "past tense, masculine singular"
        },
        {
          "t": "конечно.",
          "lemma": "конечно",
          "pos": "adv",
          "stress": "коне́чно",
          "gloss": "of course",
          "gram": "parenthetic"
        }
      ]
    },
    {
      "seg": 3,
      "trans": "After all, this guest of ours is a foreigner.",
      "words": [
        {
          "t": "Ведь",
          "lemma": "ведь",
          "pos": "part",
          "stress": null,
          "gloss": "after all",
          "gram": "particle"
        },
        {
          "t": "этот",
          "lemma": "этот",
          "pos": "det",
          "stress": "э́тот",
          "gloss": "this",
          "gram": "masculine accusative singular inanimate demonstrative pronoun"
        },
        {
          "t": "гость",
          "lemma": "гость",
          "pos": "noun",
          "stress": null,
          "gloss": "guest",
          "gram": "masculine singular nominative"
        },
        {
          "t": "у",
          "lemma": "у",
          "pos": "prep",
          "stress": null,
          "gloss": "at, near, with",
          "gram": "preposition + genitive"
        },
        {
          "t": "нас",
          "lemma": "мы",
          "pos": "pron",
          "stress": null,
          "gloss": "us",
          "gram": "1st person plural genitive"
        },
        {
          "t": "иностранец.",
          "lemma": "иностранец",
          "pos": "noun",
          "stress": "иностра́нец",
          "gloss": "foreigner",
          "gram": "nominative singular, masculine"
        }
      ]
    },
    {
      "seg": 4,
      "trans": "He passed this along to you.",
      "words": [
        {
          "t": "Он",
          "lemma": "он",
          "pos": "pron",
          "stress": null,
          "gloss": "he",
          "gram": "3rd person singular nominative"
        },
        {
          "t": "вам",
          "lemma": "вы",
          "pos": "pron",
          "stress": null,
          "gloss": "you",
          "gram": "dative 2nd person plural"
        },
        {
          "t": "вот",
          "lemma": "вот",
          "pos": "part",
          "stress": null,
          "gloss": "here, there",
          "gram": "pointing particle"
        },
        {
          "t": "это",
          "lemma": "это",
          "pos": "pron",
          "stress": "э́то",
          "gloss": "this, it (is)",
          "gram": "demonstrative, unchanging"
        },
        {
          "t": "передал.",
          "lemma": "передать",
          "pos": "verb",
          "stress": "пере́дал",
          "gloss": "to pass on, to hand over",
          "gram": "past tense, masculine singular"
        }
      ]
    },
    {
      "seg": 5,
      "trans": "This is a Michelin inspector from Paris!",
      "words": [
        {
          "t": "Это",
          "lemma": "это",
          "pos": "pron",
          "stress": "э́то",
          "gloss": "this, it (is)",
          "gram": "demonstrative, unchanging"
        },
        {
          "t": "инспектор",
          "lemma": "инспектор",
          "pos": "noun",
          "stress": "инспе́ктор",
          "gloss": "inspector",
          "gram": "masculine animate, nominative singular"
        },
        {
          "t": "Мишлен",
          "lemma": "мишлен",
          "pos": "name",
          "stress": "мишле́н",
          "gloss": "Michelin",
          "gram": "proper noun"
        },
        {
          "t": "из",
          "lemma": "из",
          "pos": "prep",
          "stress": null,
          "gloss": "from/out of",
          "gram": "preposition with genitive"
        },
        {
          "t": "Парижа!",
          "lemma": "парижа",
          "pos": "name",
          "stress": "пари́жа",
          "gloss": "Парижа",
          "gram": "proper noun"
        }
      ]
    },
    {
      "seg": 6,
      "trans": "He is their very chief inspector.",
      "words": [
        {
          "t": "Он",
          "lemma": "он",
          "pos": "pron",
          "stress": null,
          "gloss": "he",
          "gram": "3rd person singular nominative"
        },
        {
          "t": "их",
          "lemma": "они",
          "pos": "pron",
          "stress": null,
          "gloss": "their",
          "gram": "possessive pronoun"
        },
        {
          "t": "самый",
          "lemma": "самый",
          "pos": "adj",
          "stress": "са́мый",
          "gloss": "most",
          "gram": "masculine nominative singular"
        },
        {
          "t": "главный",
          "lemma": "главный",
          "pos": "adj",
          "stress": "гла́вный",
          "gloss": "main",
          "gram": "masculine singular nominative"
        },
        {
          "t": "инспектор.",
          "lemma": "инспектор",
          "pos": "noun",
          "stress": "инспе́ктор",
          "gloss": "inspector",
          "gram": "masculine animate, nominative singular"
        }
      ]
    },
    {
      "seg": 7,
      "trans": "He has already ruined many chefs.",
      "words": [
        {
          "t": "Он",
          "lemma": "он",
          "pos": "pron",
          "stress": null,
          "gloss": "he",
          "gram": "3rd person singular nominative"
        },
        {
          "t": "уже",
          "lemma": "уже",
          "pos": "adv",
          "stress": "уже́",
          "gloss": "already",
          "gram": "adverb"
        },
        {
          "t": "погубил",
          "lemma": "погубить",
          "pos": "verb",
          "stress": "погуби́л",
          "gloss": "ruined / destroyed",
          "gram": "masculine singular past"
        },
        {
          "t": "много",
          "lemma": "много",
          "pos": "adv",
          "stress": "мно́го",
          "gloss": "much",
          "gram": "adverb"
        },
        {
          "t": "поваров.",
          "lemma": "повар",
          "pos": "noun",
          "stress": "поваро́в",
          "gloss": "cooks",
          "gram": "masculine plural accusative animate"
        }
      ]
    },
    {
      "seg": 8,
      "trans": "Why is this happening to me?",
      "words": [
        {
          "t": "Почему",
          "lemma": "почему",
          "pos": "adv",
          "stress": "почему́",
          "gloss": "why",
          "gram": "interrogative adverb"
        },
        {
          "t": "со",
          "lemma": "с",
          "pos": "prep",
          "stress": null,
          "gloss": "with",
          "gram": "preposition (+instr)"
        },
        {
          "t": "мной",
          "lemma": "я",
          "pos": "pron",
          "stress": null,
          "gloss": "me",
          "gram": "instrumental 1st person singular"
        },
        {
          "t": "это",
          "lemma": "это",
          "pos": "pron",
          "stress": "э́то",
          "gloss": "this, it (is)",
          "gram": "demonstrative, unchanging"
        },
        {
          "t": "происходит?",
          "lemma": "происходить",
          "pos": "verb",
          "stress": "происхо́дит",
          "gloss": "is happening",
          "gram": "3rd person singular present"
        }
      ]
    },
    {
      "seg": 9,
      "trans": "Just do not get nervous right now.",
      "words": [
        {
          "t": "Вы",
          "lemma": "вы",
          "pos": "pron",
          "stress": null,
          "gloss": "you (polite/plural)",
          "gram": "2nd person plural, nominative"
        },
        {
          "t": "только",
          "lemma": "только",
          "pos": "part",
          "stress": "то́лько",
          "gloss": "only",
          "gram": "particle"
        },
        {
          "t": "сейчас",
          "lemma": "сейчас",
          "pos": "adv",
          "stress": "сейча́с",
          "gloss": "now",
          "gram": "adverb"
        },
        {
          "t": "не",
          "lemma": "не",
          "pos": "part",
          "stress": null,
          "gloss": "not",
          "gram": "negation"
        },
        {
          "t": "нервничайте.",
          "lemma": "нервничать",
          "pos": "verb",
          "stress": "нервнича́йте",